nombre_diagnostico|nombre_diagnostico_psiquiatrico
Estado de receptor de estrógeno positivo [RE+]|Otros tipos de esquizofrenia
Gastroenteritis y colitis tóxica|Otros tipos de esquizofrenia
Otras miocardiopatías restrictivas|Otros tipos de esquizofrenia
Trastorno de personalidad, no especificado|Trastorno psicótico breve
Infección de tracto urinario, localización no especificada|Trastorno psicótico breve
Hipertensión intracraneal benigna|Otros tipos de esquizofrenia
Presencia de dispositivo para drenaje de líquido cefalorraquídeo|Otros tipos de esquizofrenia
Diabetes mellitus tipo 2 con angiopatía periférica diabética sin gangrena|Otros tipos de esquizofrenia
Gangrena, no clasificada bajo otro concepto|Otros tipos de esquizofrenia
Celulitis de dedo de pie no especificado|Otros tipos de esquizofrenia
Consumo de alcohol no especificado, con trastorno amnésico persistente inducido por alcohol|Otros tipos de esquizofrenia
Síndrome de secreción inadecuada de hormona antidiurética|Otros tipos de esquizofrenia
Neoplasia de comportamiento incierto de vejiga|Otros tipos de esquizofrenia
Tumores neuroendocrinos malignos mal diferenciados|Otros tipos de esquizofrenia
Tumores carcinoides secundarios de ganglios linfáticos a distancia|Otros tipos de esquizofrenia
Tumores carcinoides secundarios de hueso|Otros tipos de esquizofrenia
Contacto para cuidados paliativos|Otros tipos de esquizofrenia
Contusión de parte inferior de espalda y pelvis, contacto inicial|Otros tipos de esquizofrenia
Enfisema intersticial|Otros tipos de esquizofrenia
Cuerpo extraño residual en partes blandas|Otros tipos de esquizofrenia
Desgarro grave de bazo, contacto inicial|Trastorno esquizoide de personalidad
Fractura no especificada de vértebra lumbar no especificada, contacto inicial por fractura cerrada|Trastorno esquizoide de personalidad
Anemia poshemorrágica aguda|Trastorno esquizoide de personalidad
Historia personal de neoplasia maligna de testículo|Trastorno esquizoide de personalidad
Ausencia adquirida de otro (-s) órgano (-s) genital (-es)|Trastorno esquizoide de personalidad
Historia personal de quimioterapia antineoplásica|Trastorno esquizoide de personalidad
Trastorno esquizotípico|Trastorno esquizoide de personalidad
Dependencia de nicotina no especificada, sin complicaciones|Trastorno esquizoide de personalidad
Historia personal de otro tipo de trombosis y embolia venosas|Trastorno esquizoide de personalidad
Uso prolongado (actual) de anticoagulantes|Trastorno esquizoide de personalidad
Historia personal de dependencia a nicotina|Trastorno esquizoide de personalidad
Reacción inespecífica a la prueba cutánea de la tuberculina sin tuberculosis activa|Otros tipos de esquizofrenia
Problemas relacionados con el empleo no especificados|Otros tipos de esquizofrenia
Estado de alergia a anestésico|Otros tipos de esquizofrenia
Síndrome metabólico|Otros tipos de esquizofrenia
Colitis ulcerosa, no especificada, sin complicaciones|Trastornos delirantes
Congestión pasiva crónica de hígado|Trastornos delirantes
Anemia ferropénica, no especificada|Trastornos delirantes
Envenenamiento por fármacos, medicamentos y sustancias biológicas no especificados, accidental (no intencionado), contacto inicial|Trastornos delirantes
Hepatitis vírica crónica tipo C|Trastornos delirantes
Dependencia de opiáceos, sin complicaciones|Trastornos delirantes
Otros estafilococos como causa de enfermedades clasificadas bajo otro concepto|Otros tipos de esquizofrenia
Otros trastornos del pulmón|Otros tipos de esquizofrenia
Úlcera por presión en talón no especificado, estadio no especificado|Otros tipos de esquizofrenia
Infección por Staphylococcus aureus resistente a meticilina como causa de enfermedades clasificadas bajo otro concepto|Otros tipos de esquizofrenia
Klebsiella pneumoniae [K. pneumoniae] como causa de enfermedades clasificadas bajo otro concepto|Otros tipos de esquizofrenia
Rivalidad entre hermanos|Trastornos delirantes
Shock hipovolémico|Otros tipos de esquizofrenia
Adherencias [bridas] intestinales con obstrucción (posinfección)|Otros tipos de esquizofrenia
Problemas relacionados con otras circunstancias legales|Otros tipos de esquizofrenia
Luxación no especificada de cadera no especificada, contacto inicial|Otros tipos de esquizofrenia
Diabetes insípida|Otros tipos de esquizofrenia
Epilepsia y síndromes epilépticos generalizados idiopáticos, no intratables, sin estado de mal epiléptico|Otros tipos de esquizofrenia
Trastorno obsesivo-compulsivo|Trastornos delirantes
Neoplasia maligna no especificada de piel de parte no especificada de la cara|Otros tipos de esquizofrenia
Neoplasia maligna no especificada de localizaciones contiguas de piel|Otros tipos de esquizofrenia
Neoplasia maligna secundaria de otras localizaciones especificadas|Otros tipos de esquizofrenia
Parálisis de Bell|Otros tipos de esquizofrenia
Complicación de atención quirúrgica y médica, no especificada, secuela|Otros tipos de esquizofrenia
Esclerosis múltiple|Otros tipos de esquizofrenia
Consumo de otra sustancia psicoactiva, no especificado, con demencia persistente inducida por sustancias psicoactivas|Trastorno esquizoide de personalidad
Demencia no especificada, gravedad no especificada, sin alteración del comportamiento, alteración psicótica, alteración del estado de ánimo ni ansiedad|Trastorno esquizoide de personalidad
Miocardiopatía isquémica|Trastorno esquizoide de personalidad
Presencia de injerto derivación aortocoronaria|Trastorno esquizoide de personalidad
Hipertensión esencial (primaria)|Trastorno esquizoide de personalidad
Diabetes mellitus tipo 2 sin complicaciones|Trastorno esquizoide de personalidad
Otros tipos de hiperlipidemia|Trastorno esquizoide de personalidad
Hemotórax traumático, contacto inicial|Otros tipos de esquizofrenia
Traumatismo no especificado de otros órganos intratorácicos especificados, contacto inicial|Otros tipos de esquizofrenia
Trastorno de conducta, no especificado|Otros tipos de esquizofrenia
Asma no especificada, sin complicaciones|Otros tipos de esquizofrenia
Otros tipos de glucemia anormal|Otros tipos de esquizofrenia
Broncoespasmo agudo|Otros tipos de esquizofrenia
Trastorno de personalidad antisocial|Otros tipos de esquizofrenia
Esofagitis por cándidas|Otros tipos de esquizofrenia
Historia personal de fractura (consolidada) traumática|Otros tipos de esquizofrenia
Trastorno distímico|Otros tipos de esquizofrenia
Portador o sospecha de portador de Staphylococcus aureus resistente a meticilina|Otros tipos de esquizofrenia
Bloqueo fascicular anterior izquierdo|Otros tipos de esquizofrenia
Papilomavirus como causa de enfermedades clasificadas bajo otro concepto|Otros tipos de esquizofrenia
Dependencia de opiáceos, en remisión|Otros tipos de esquizofrenia
Fibrosis pulmonar, no especificada|Otros tipos de esquizofrenia
Abuso de cannabis, sin complicaciones|Trastorno psicótico breve
Cuerpo extraño en intestino delgado, contacto inicial|Otros tipos de esquizofrenia
Historia personal de pólipos colónicos|Otros tipos de esquizofrenia
Espondilosis sin mielopatía ni radiculopatía, región torácica|Otros tipos de esquizofrenia
Celulitis de parte no especificada de las extremidades|Otros tipos de esquizofrenia
Glucemia basal alterada|Otros tipos de esquizofrenia
Hidrocefalia normotensiva (idiopática)|Otros tipos de esquizofrenia
Uso prolongado (actual) de antitrombóticos / antiplaquetarios|Otros tipos de esquizofrenia
Gammapatía monoclonal|Otros tipos de esquizofrenia
Cuerpo extraño no especificado en vías respiratorias, parte no especificada, que produce asfixia, contacto inicial|Otros tipos de esquizofrenia
Taquicardia paroxística, no especificada|Otros tipos de esquizofrenia
Disfunción neuromuscular de vejiga, no especificada|Otros tipos de esquizofrenia
Neoplasia maligna de colon sigmoide|Otros tipos de esquizofrenia
Enfermedad isquémica crónica cardiaca, no especificada|Otros tipos de esquizofrenia
Ausencia adquirida de miembro no especificado|Otros tipos de esquizofrenia
Cálculo del uréter|Otros tipos de esquizofrenia
Cólico renal no especificado|Otros tipos de esquizofrenia
Estado de alergia a analgésico|Trastorno psicótico breve
Historia familiar de epilepsia y otras enfermedades del sistema nervioso|Trastornos delirantes
Trastorno disociativo y de conversión, no especificado|Trastorno psicótico breve
Tirotoxicosis, no especificada sin crisis tirotóxica ni tormenta tiroidea|Trastorno psicótico breve
Persona sin hogar|Otros tipos de esquizofrenia
Bloqueo auriculoventricular, primer grado|Trastornos delirantes
Distonía aguda inducida por fármacos|Otros tipos de esquizofrenia
Efecto adverso de penicilinas, contacto inicial|Otros tipos de esquizofrenia
Estado de alergia a contrastes radiográficos|Otros tipos de esquizofrenia
Edema angioneurótico, contacto inicial|Otros tipos de esquizofrenia
Abuso de otro estimulante, sin complicaciones|Trastornos delirantes
Hernia inguinal unilateral, sin obstrucción ni gangrena, no especificada como recidivada|Trastornos delirantes
Envenenamiento por antidepresivos no especificados, accidental (no intencionado), contacto inicial|Otros tipos de esquizofrenia
Efecto tóxico de etanol, accidental (no intencionado), contacto inicial|Otros tipos de esquizofrenia
Herida abierta no especificada de antebrazo no especificado, contacto inicial|Otros tipos de esquizofrenia
Taquicardia supraventricular|Otros tipos de esquizofrenia
Infección y reacción inflamatoria por (debida a) otros dispositivos, implantes e injertos cardiacos y vasculares, contacto inicial|Otros tipos de esquizofrenia
Sepsis debida a otro estafilococo especificado|Otros tipos de esquizofrenia
Pasajero de coche lesionado en colisión con tren o vehículo ferroviario en un accidente no de tráfico|Otros tipos de esquizofrenia
Fractura no especificada de extremo superior de húmero no especificado, contacto inicial por fractura cerrada|Otros tipos de esquizofrenia
Penfigoide ampolloso|Otros tipos de esquizofrenia
Enfermedad cardíaca hipertensiva con insuficiencia cardiaca|Otros tipos de esquizofrenia
Historia personal de neoplasia maligna de otros órganos genitales femeninos|Otros tipos de esquizofrenia
Sepsis debida a Salmonella|Otros tipos de esquizofrenia
Otras sepsis especificadas|Otros tipos de esquizofrenia
Enteritis debida a Campylobacter|Otros tipos de esquizofrenia
Enteritis debida a Salmonella|Otros tipos de esquizofrenia
Otras alteraciones especificadas de la coagulación|Otros tipos de esquizofrenia
Neumonía intersticial idiopática, no especificada de otro modo|Otros tipos de esquizofrenia
Insuficiencia hepática, no especificada, sin coma|Otros tipos de esquizofrenia
Otros tipos de ascitis|Otros tipos de esquizofrenia
Carcinoma de células hepáticas|Otros tipos de esquizofrenia
Hemocromatosis hereditaria|Otros tipos de esquizofrenia
Obstrucción intestinal no especificada|Otros tipos de esquizofrenia
Enfermedad cardiaca hipertensiva sin insuficiencia cardiaca|Trastornos delirantes
Úlcera gástrica crónica sin hemorragia ni perforación|Otros tipos de esquizofrenia
Espondilosis sin mielopatía ni radiculopatía, localización no especificada|Otros tipos de esquizofrenia
Otros problemas especificados relacionados con circunstancias psicosociales|Otros tipos de esquizofrenia
Ludopatía|Otros tipos de esquizofrenia
Envenenamiento por fármacos psicótropos no especificados, accidental (no intencionado), contacto inicial|Otros tipos de esquizofrenia
Coma no especificado|Otros tipos de esquizofrenia
Policitemia secundaria|Otros tipos de esquizofrenia
Sobrepeso|Otros tipos de esquizofrenia
Somnolencia|Otros tipos de esquizofrenia
Hernia incisional con obstrucción, sin gangrena|Otros tipos de esquizofrenia
Colelitiasis retenida después de colecistectomía|Otros tipos de esquizofrenia
Historia personal de neoplasia maligna de cuello uterino|Otros tipos de esquizofrenia
Fractura desplazada de base del cuello de fémur no especificado, contacto inicial por fractura cerrada|Otros tipos de esquizofrenia
Enfermedad cardiaca y renal crónica hipertensiva con insuficiencia cardiaca y con enfermedad renal crónica en estadio 5 o con enfermedad renal en estadio terminal|Otros tipos de esquizofrenia
Enfermedad renal crónica, estadio fase 5|Otros tipos de esquizofrenia
Anemia, no especificada|Otros tipos de esquizofrenia
Diabetes mellitus tipo 2 con otra artropatía diabética|Trastornos delirantes
Hipergammaglobulinemia, no especificada|Trastornos delirantes
Insuficiencia cerebrovascular aguda|Trastornos delirantes
Pérdida de audición no especificada, oído no especificado|Trastornos delirantes
Cálculo de vesícula biliar sin colecistitis sin obstrucción|Trastornos delirantes
Enfermedad cardiaca y renal crónica hipertensiva sin insuficiencia cardiaca, con enfermedad renal crónica en estadio 1 a 4 o enfermedad renal crónica no especificada|Otros tipos de esquizofrenia
Retinopatía hipertensiva, ojo no especificado |Otros tipos de esquizofrenia
Fractura de parte no especificada de cuerpo de mandíbula, lado no especificado, contacto inicial por fractura cerrada|Otros tipos de esquizofrenia
Encefalopatía, no especificada|Otros tipos de esquizofrenia
Trombocitopenia no especificada|Otros tipos de esquizofrenia
Historia personal de enfermedad ulcerosa péptica|Trastornos delirantes
Estado de alergia a analgésico|Trastornos delirantes
Otros tipos de hiperalimentación especificados|Otros tipos de esquizofrenia
Otras anomalías de los hematíes|Otros tipos de esquizofrenia
Diabetes mellitus tipo 2 con nefropatía diabética|Otros tipos de esquizofrenia
Trastornos glomerulares en enfermedades clasificadas bajo otro concepto|Otros tipos de esquizofrenia
Proteinuria de Bence Jones|Otros tipos de esquizofrenia
Hiperplasia prostática benigna con síntomas de tracto urinario inferior|Otros tipos de esquizofrenia
Malnutrición calórico-proteica leve|Otros tipos de esquizofrenia
Otros tipos de impactación de intestino|Otros tipos de esquizofrenia
Hemorragia epidural sin pérdida de conciencia, contacto inicial|Otros tipos de esquizofrenia
Embolia y trombosis de arterias de los miembros inferiores|Otros tipos de esquizofrenia
Historia personal de tuberculosis|Otros tipos de esquizofrenia
Presencia de articulación de rodilla artificial, no especificada|Trastornos delirantes
Neoplasia maligna de lóbulo inferior, bronquio o pulmón no especificados|Otros tipos de esquizofrenia
Neoplasia maligna secundaria y no especificada de ganglios linfáticos intratorácicos|Otros tipos de esquizofrenia
Otra osteoartropatía hipertrófica, localización no especificada|Otros tipos de esquizofrenia
Aneurisma aórtico abdominal, sin rotura|Otros tipos de esquizofrenia
Aterosclerosis no especificada de arterias nativas de las extremidades, extremidad no especificada|Otros tipos de esquizofrenia
Artritis reumatoide no especificada|Otros tipos de esquizofrenia
Hiperparatiroidismo secundario de origen renal|Otros tipos de esquizofrenia
Incontinencia urinaria no especificada|Otros tipos de esquizofrenia
Gastritis crónica atrófica sin hemorragia|Otros tipos de esquizofrenia
Artrosis primaria generalizada|Otros tipos de esquizofrenia
Fractura no especificada desplazada de primera vértebra cervical, contacto sucesivo por fractura con fracaso de consolidación|Otros tipos de esquizofrenia
Dolor epigástrico|Otros tipos de esquizofrenia
Dependencia de nicotina no especificada, sin complicaciones|Trastorno psicótico breve
Hernia inguinal unilateral, sin obstrucción ni gangrena, no especificada como recidivada|Otros tipos de esquizofrenia
Otro asesoramiento específico|Trastorno psicótico breve
Desempleo, no especificado|Trastorno psicótico breve
Fractura desplazada de olécranon sin extensión intraarticular de cúbito no especificado, contacto inicial por fractura cerrada|Otros tipos de esquizofrenia
Leucemia mieloblástica aguda, en remisión|Otros tipos de esquizofrenia
Pitiriasis versicolor|Otros tipos de esquizofrenia
Trastorno bipolar, episodio actual maníaco, grave, con rasgos psicóticos|Otros tipos de esquizofrenia
Enfermedad cardiaca y renal crónica hipertensiva con insuficiencia cardiaca y enfermedad renal crónica estadios 1 a 4 o enfermedad renal crónica no especificada|Otros tipos de esquizofrenia
Otros trastornos del cerebro en enfermedades clasificadas bajo otro concepto|Otros tipos de esquizofrenia
Neumonía debida a Staphylococcus aureus resistente a meticilina|Otros tipos de esquizofrenia
Hemiplejia y hemiparesia tras enfermedad cerebrovascular no especificada con afectación de lado derecho no dominante|Otros tipos de esquizofrenia
Disartria tras enfermedad cerebrovascular no especificada|Otros tipos de esquizofrenia
Afasia|Otros tipos de esquizofrenia
Dependencia de alcohol con delirio por abstinencia|Otros tipos de esquizofrenia
Herida abierta no especificada de hombro no especificado, contacto inicial|Otros tipos de esquizofrenia
Quemadura de grado no especificado de cabeza, cara y cuello de localización no especificada, secuela|Otros tipos de esquizofrenia
Episodio maníaco, grave, con síntomas psicóticos|Trastornos delirantes
Hallazgo de otras sustancias especificadas, que no se encuentran normalmente en sangre|Trastornos delirantes
Temblor esencial|Trastornos delirantes
Otra diabetes mellitus especificada sin complicaciones|Otros tipos de esquizofrenia
Otros tipos de obstrucción intestinal|Otros tipos de esquizofrenia
Leiomioma de útero, no especificado|Trastornos delirantes
Trastorno extrapiramidal y del movimiento, no especificado|Otros tipos de esquizofrenia
Sinusitis aguda, no especificada|Otros tipos de esquizofrenia
Flebitis y tromboflebitis de vasos superficiales de extremidad inferior no especificada|Otros tipos de esquizofrenia
Insuficiencia congénita de la válvula aórtica|Otros tipos de esquizofrenia
Aneurisma aórtico torácico, sin rotura|Otros tipos de esquizofrenia
Comunicación interauricular|Otros tipos de esquizofrenia
Cardiomegalia|Otros tipos de esquizofrenia
Espondilosis sin mielopatía ni radiculopatía, región lumbosacra|Otros tipos de esquizofrenia
Parada cardiaca intraoperatoria durante cirugía cardiaca|Otros tipos de esquizofrenia
Problemas relacionados con otras circunstancias legales|Trastornos delirantes
Discapacidad intelectual leve|Trastorno psicótico breve
Diabetes mellitus tipo 2 con retinopatía diabética no especificada con edema macular|Trastornos delirantes
Diabetes mellitus tipo 2 con retinopatía diabética no especificada sin edema macular|Trastornos delirantes
Desprendimiento de retina seroso, ojo no especificado |Trastornos delirantes
Osteomielitis, no especificada|Trastornos delirantes
Infección por Staphylococcus aureus sensible a meticilina como causa de enfermedades clasificadas bajo otro concepto|Trastornos delirantes
Úlcera gástrica aguda con hemorragia|Otros tipos de esquizofrenia
Espondilitis anquilosante de localizaciones no especificadas de la columna vertebral|Otros tipos de esquizofrenia
Otras miocardiopatías restrictivas|Trastornos delirantes
Otros acontecimientos de la vida que generan estrés en la familia y el hogar|Otros tipos de esquizofrenia
Síndrome del túnel carpiano, extremidad superior no especificada|Otros tipos de esquizofrenia
Priapismo, no especificado|Otros tipos de esquizofrenia
Neoplasia maligna de antro pilórico|Otros tipos de esquizofrenia
Catarata senil, no especificada|Otros tipos de esquizofrenia
Diabetes mellitus tipo 2 con retinopatía diabética no especificada con edema macular|Otros tipos de esquizofrenia
Diabetes mellitus tipo 2 con retinopatía diabética no especificada sin edema macular|Otros tipos de esquizofrenia
Hemorragia de vítreo, bilateral |Otros tipos de esquizofrenia
Presencia de lente intraocular|Otros tipos de esquizofrenia
Neoplasia maligna secundaria de pulmón no especificado|Otros tipos de esquizofrenia
Conducta heterosexual de alto riesgo|Otros tipos de esquizofrenia
Dermatitis seborreica, no especificada|Otros tipos de esquizofrenia
Perforación de intestino (no traumática)|Otros tipos de esquizofrenia
Peritonitis (aguda) generalizada|Otros tipos de esquizofrenia
Neoplasia lipomatosa benigna de otros sitios|Otros tipos de esquizofrenia
Disección de aorta torácica|Otros tipos de esquizofrenia
Embolia y trombosis de aorta torácica|Otros tipos de esquizofrenia
Otras gastroenteritis y colitis no infecciosas especificadas|Otros tipos de esquizofrenia
Hipotensión ortostática|Otros tipos de esquizofrenia
Neoplasia maligna de parte no especificada, bronquio o pulmón no especificados|Otros tipos de esquizofrenia
Neoplasia maligna secundaria de cerebro|Otros tipos de esquizofrenia
Anemia por carencia dietética de ácido fólico|Otros tipos de esquizofrenia
Dolor en hombro no especificado|Otros tipos de esquizofrenia
Glaucoma no especificado|Otros tipos de esquizofrenia
Contacto para cuidados posquirúrgicos de cirugía en piel y tejido subcutáneo|Otros tipos de esquizofrenia
Marasmo nutricional|Otros tipos de esquizofrenia
Otros agentes bacterianos como causa de enfermedades clasificadas bajo otro concepto|Otros tipos de esquizofrenia
Historia personal de infecciones del sistema nervioso central|Otros tipos de esquizofrenia
Fractura intertrocantérea desplazada de fémur no especificado, contacto inicial por fractura cerrada|Otros tipos de esquizofrenia
Neoplasia benigna de glándula suprarrenal no especificada|Otros tipos de esquizofrenia
Enfermedad por reflujo gastroesofágico sin esofagitis|Otros tipos de esquizofrenia
Cálculo del riñón|Otros tipos de esquizofrenia
Hemorragia traumática de cerebro, no especificada, sin pérdida de conciencia, contacto inicial|Otros tipos de esquizofrenia
Divertículo de vejiga|Otros tipos de esquizofrenia
Hidrocele, no especificado|Otros tipos de esquizofrenia
Secuelas de otras enfermedades infecciosas y parasitarias especificadas|Otros tipos de esquizofrenia
Neurosífilis no especificada|Otros tipos de esquizofrenia
Espondilosis sin mielopatía ni radiculopatía, región cervical|Otros tipos de esquizofrenia
Cuerpo extraño no especificado en laringe que produce asfixia, contacto inicial|Otros tipos de esquizofrenia
Neoplasia maligna de ángulo esplénico|Otros tipos de esquizofrenia
Hemiplejia y hemiparesia tras enfermedad cerebrovascular no especificada con afectación de lado no especificado|Otros tipos de esquizofrenia
Historia personal de neumonía (recurrente)|Otros tipos de esquizofrenia
Enfermedad de Crohn de intestino grueso sin complicaciones|Otros tipos de esquizofrenia
Discinesia subaguda inducida por fármacos|Otros tipos de esquizofrenia
Trastorno depresivo mayor, episodio único, moderado|Otros tipos de esquizofrenia
Estado de alergia a otros fármacos, medicamentos y sustancias biológicas|Trastorno psicótico breve
Delirio debido a afección fisiológica conocida|Trastorno psicótico breve
Diabetes mellitus tipo 2 sin complicaciones|Trastorno psicótico breve
Miocardiopatía isquémica|Trastorno psicótico breve
Enfermedad renal en estadio terminal|Trastorno psicótico breve
Dependencia de diálisis renal|Trastorno psicótico breve
Ausencia adquirida de otros órganos|Trastorno psicótico breve
Uso prolongado (actual) de insulina|Trastorno psicótico breve
Estado de alergia a penicilina|Trastorno psicótico breve
Diabetes mellitus tipo 2 con otra artropatía diabética|Trastorno psicótico breve
Apnea del sueño, no especificada|Otros tipos de esquizofrenia
Aterosclerosis de arterias nativas de extremidades con dolor en reposo, extremidad no especificada|Trastornos delirantes
Delirio debido a afección fisiológica conocida|Trastornos delirantes
Historia personal de otras enfermedades infecciosas y parasitarias|Trastornos delirantes
Dermatitis de contacto no especificada, causa no especificada|Trastornos delirantes
Otros trastornos especificados de la piel y del tejido subcutáneo|Trastornos delirantes
Hallux valgus (adquirido), pie no especificado|Otros tipos de esquizofrenia
Neoplasia maligna de localizaciones contiguas de bronquio y pulmón no especificados|Otros tipos de esquizofrenia
Envenenamiento por psicoestimulantes no especificados, accidental (no intencionado), contacto inicial|Otros tipos de esquizofrenia
Neoplasia benigna de hígado|Otros tipos de esquizofrenia
Ausencia adquirida de extremidad superior no especificada, nivel no especificado|Otros tipos de esquizofrenia
Neoplasia benigna de hipófisis|Trastornos delirantes
Diabetes mellitus tipo 2 con hiperosmolaridad sin coma hiperglucémico hiperosmolar no cetósico (CHHNC)|Trastornos delirantes
Úlcera duodenal, no especificada como aguda ni como crónica, sin hemorragia ni perforación|Trastornos delirantes
Ceguera, un ojo, baja visión en el otro ojo, ojo no especificado|Trastornos delirantes
Insuficiencia cardiaca sistólica (congestiva), no especificada|Trastornos delirantes
Retención urinaria, no especificada|Trastornos delirantes
Ceguera, ambos ojos|Trastornos delirantes
Insuficiencia respiratoria crónica no especificada si con hipoxia o con hipercapnia|Trastornos delirantes
Artrosis de cadera no especificada|Otros tipos de esquizofrenia
Paro respiratorio|Otros tipos de esquizofrenia
Neoplasia benigna de estómago|Otros tipos de esquizofrenia
Íleo por cálculo biliar|Otros tipos de esquizofrenia
Pancolitis ulcerosa (crónica) sin complicaciones|Trastornos delirantes
Kwashiorkor|Trastornos delirantes
Miopía degenerativa, bilateral |Trastornos delirantes
Otras secuelas tras enfermedad cerebrovascular no especificada|Trastornos delirantes
Ausencia adquirida de otro (-s) órgano (-s) genital (-es)|Trastornos delirantes
Absceso periapical sin sinus|Otros tipos de esquizofrenia
Sinusitis crónica maxilar|Otros tipos de esquizofrenia
Abuso de otro estimulante, sin complicaciones|Otros tipos de esquizofrenia
