nombre_diagnostico|nombre_diagnostico_psiquiatrico
Hipercolesterolemia pura|Esquizofrenia
Estado de dependencia de respirador [ventilador]|Esquizofrenia
Dependencia de nicotina, otro producto de tabaco, sin complicaciones|Esquizofrenia
Neumonía por Streptococcus pneumoniae|Esquizofrenia
Hemiplejia y hemiparesia tras enfermedad cerebrovascular no especificada con afectación de lado derecho dominante|Otros tipos de esquizofrenia
Enfermedad renal crónica hipertensiva con enfermedad renal crónica en estadio 5 o con enfermedad renal en estadio terminal|Otros tipos de esquizofrenia
Hemorragia subdural no traumática, no especificada|Esquizofrenia
Escala de coma, apertura ocular, al sonido, 24 horas o más del ingreso hospitalario|Esquizofrenia
Escala de coma, mejor respuesta verbal, ninguna, 24 horas o más después del ingreso hospitalario|Esquizofrenia
Escala de coma, mejor respuesta motora, retirada en flexión, 24 horas o más después del ingreso hospitalario|Esquizofrenia
Enfermedad cardiaca hipertensiva sin insuficiencia cardiaca|Esquizofrenia
Artritis reumatoide no especificada|Esquizofrenia
Osteítis deformante, hueso no especificado|Esquizofrenia
Trastorno de personalidad obsesivo-compulsivo|Trastornos esquizoafectivos
Alucinaciones auditivas|Trastornos esquizoafectivos
Trastorno de identidad sexual, no especificado|Trastornos esquizoafectivos
Esguince de ligamento colateral interno de rodilla izquierda, contacto inicial|Esquizofrenia
Diabetes mellitus tipo 2 con nefropatía diabética|Trastornos delirantes
Infarto de miocardio antiguo|Trastornos delirantes
Ausencia adquirida de ovarios, bilateral|Trastornos delirantes
Encefalitis herpética|Esquizofrenia
Asma no especificada con exacerbación (aguda)|Esquizofrenia
Embolia y trombosis agudas de vena axilar izquierda|Esquizofrenia
Embolia y trombosis agudas de vena subclavia izquierda|Esquizofrenia
Malnutrición calórico-proteica leve|Esquizofrenia
Hemorragia, no clasificada bajo otro concepto|Otros tipos de esquizofrenia
Malnutrición calórico-proteica no especificada|Otros tipos de esquizofrenia
Flebitis y tromboflebitis de otras localizaciones|Otros tipos de esquizofrenia
Bronconeumonía, microorganismo no especificado|Esquizofrenia
Pérdida auditiva neurosensorial no especificada|Esquizofrenia
Temblor no especificado|Esquizofrenia
Linfomas de células T/NK maduras, no especificados, ganglios linfáticos intraabdominales|Otros tipos de esquizofrenia
Dieta y hábitos alimentarios inapropiados|Otros tipos de esquizofrenia
Gastroenteritis y colitis no infecciosas, no especificadas|Trastornos delirantes
Alteración transitoria de conciencia|Trastornos delirantes
Tumores neuroendocrinos malignos mal diferenciados|Trastornos delirantes
Hipercalcemia|Trastornos delirantes
Enfermedad por reflujo gastroesofágico sin esofagitis|Trastornos delirantes
Contacto para cuidados paliativos|Trastornos delirantes
Persona en espera de admisión en servicio de salud en otro lugar|Otros tipos de esquizofrenia
Necesidad de asistencia con cuidado personal|Trastornos esquizoafectivos
Hemorragia intracerebral no traumática, no especificada|Trastornos delirantes
Gota, no especificada|Trastornos delirantes
Trastorno no especificado de la función vestibular, bilateral|Trastornos delirantes
Historia personal de otras neoplasias malignas de tejidos linfáticos, hemopoyéticos y tejidos relacionados|Trastornos delirantes
Problemas en la relación con el cónyuge o pareja|Psicosis no especificada no debida a sustancia o afección fisiológica conocidas
Aneurisma aórtico abdominal, roto|Esquizofrenia
Otras complicaciones intraoperatorias de aparato circulatorio, no clasificados bajo otro concepto|Esquizofrenia
Infarto agudo de médula espinal (embólico) (no embólico)|Esquizofrenia
Paraplejia, no especificada|Esquizofrenia
Herida abierta no especificada de muslo izquierdo, contacto inicial|Psicosis no especificada no debida a sustancia o afección fisiológica conocidas
Traumatismo no especificado de arteria femoral de pierna izquierda, contacto inicial|Psicosis no especificada no debida a sustancia o afección fisiológica conocidas
Traumatismo de nervio femoral a nivel de cadera y muslo, lado derecho, contacto inicial|Psicosis no especificada no debida a sustancia o afección fisiológica conocidas
Contacto con cuchillo, contacto inicial|Psicosis no especificada no debida a sustancia o afección fisiológica conocidas
Síndrome mielodisplásico, no especificado|Trastornos delirantes
Úlcera gástrica, no especificada como aguda ni crónica, sin hemorragia ni perforación|Trastornos delirantes
Cifosis no especificada, localización no especificada|Trastornos delirantes
Trastorno bipolar, episodio actual mixto, grave, con rasgos psicóticos|Otros tipos de esquizofrenia
Hipotiroidismo debido a medicamentos y otras sustancias exógenas|Otros tipos de esquizofrenia
Delirio debido a afección fisiológica conocida|Trastornos esquizoafectivos
Infradosificación de fármacos psicótropos no especificado, contacto inicial|Trastornos esquizoafectivos
Temblor inducido por fármacos|Trastornos esquizoafectivos
Efecto adverso de fármaco psicótropo no especificado, contacto inicial|Trastornos esquizoafectivos
Neumonía por Escherichia coli|Otros tipos de esquizofrenia
Artrosis primaria unilateral, cadera izquierda|Esquizofrenia
Otras anomalías de los hematíes|Esquizofrenia
Desempleo, no especificado|Trastornos esquizoafectivos
Infarto agudo de miocardio con elevación de ST (IAMCEST) (IMEST) (STEMI) con implicación de otra arteria coronaria de cara inferior|Esquizofrenia
Necesidad de asistencia en el hogar sin otro miembro de la familia que pueda prestar cuidados|Otros tipos de esquizofrenia
Carcinoma in situ de colon|Otros tipos de esquizofrenia
Hipertrofia mamaria|Otros tipos de esquizofrenia
Angiodisplasia de colon sin hemorragia|Trastornos delirantes
Trastorno de conducta, no especificado|Trastornos delirantes
Fibrilación paroxística auricular|Trastornos delirantes
Enfermedad renal crónica, estadio 4 (grave)|Trastornos delirantes
Artrosis primaria de rodilla, bilateral|Trastornos delirantes
Otros tipos de espondilosis, región lumbar|Trastornos delirantes
Presencia de válvula cardiaca protésica|Trastornos delirantes
Dependencia de otra sustancia psicoactiva, en remisión|Psicosis no especificada no debida a sustancia o afección fisiológica conocidas
Dependencia de opiáceos, sin complicaciones|Psicosis no especificada no debida a sustancia o afección fisiológica conocidas
Problemas relacionados con otras circunstancias legales|Psicosis no especificada no debida a sustancia o afección fisiológica conocidas
Trastorno vascular de intestino, no especificado|Otros tipos de esquizofrenia
Fractura de huesos nasales, contacto inicial por fractura cerrada|Esquizofrenia
Fractura de una costilla de lado derecho, contacto inicial por fractura cerrada|Esquizofrenia
Agresión por pelea o lucha sin armas, contacto inicial|Esquizofrenia
Otras entesopatías, no clasificadas bajo otro concepto|Otros tipos de esquizofrenia
Otras enfermedades especificadas de ano y recto|Otros tipos de esquizofrenia
Fisura anal, no especificada|Otros tipos de esquizofrenia
Intoxicación alimentaria bacteriana, no especificada|Otros tipos de esquizofrenia
Enfermedad renal crónica, estadio 4 (grave)|Otros tipos de esquizofrenia
Enterococos como causa de enfermedades clasificadas bajo otro concepto|Esquizofrenia
Dependencia de nicotina no especificada, sin complicaciones|Esquizofrenia
Infección de tracto urinario, localización no especificada|Trastornos esquizoafectivos
Aneurisma aórtico torácico, sin rotura|Trastornos esquizoafectivos
Cálculo de vesícula biliar con colecistitis crónica sin obstrucción|Trastornos esquizoafectivos
Uso prolongado (actual) de anticoagulantes|Trastornos esquizoafectivos
Trastorno mental no especificado debido a afección fisiológica conocida|Trastornos esquizoafectivos
Fibrilación auricular no especificada|Trastornos esquizoafectivos
Aneurisma aórtico abdominal, sin rotura|Trastornos esquizoafectivos
Trastorno adaptativo, no especificado|Trastornos delirantes
Ausencia adquirida de otros órganos|Trastornos delirantes
Obstrucción intestinal posprocedimiento|Otros tipos de esquizofrenia
Ausencia adquirida (de parte) del pulmón|Otros tipos de esquizofrenia
Envenenamiento por fármacos psicótropos no especificados, autolesión intencionada, contacto inicial|Esquizofrenia
Afecciones inflamatorias de los maxilares|Esquizofrenia
Diabetes mellitus tipo 2 con hiperosmolaridad sin coma hiperglucémico hiperosmolar no cetósico (CHHNC)|Esquizofrenia
Hígado graso (degeneración grasa) de hígado, no clasificado bajo otro concepto|Esquizofrenia
Hemorragia y hematoma intraoperatorios de un órgano o estructura de aparato digestivo, que complica un procedimiento de aparato digestivo|Esquizofrenia
Neoplasia benigna de colon, no especificada|Esquizofrenia
Neoplasia benigna de recto|Esquizofrenia
Hemorragia posprocedimiento de un órgano o estructura del aparato digestivo después de un procedimiento del aparato digestivo|Esquizofrenia
Gripe debida a otros tipos de virus de la gripe identificados con otras manifestaciones respiratorias|Esquizofrenia
Uso prolongado (actual) de esteroides inhalados|Otros tipos de esquizofrenia
Hepatitis vírica crónica tipo C|Trastorno psicótico breve
Hígado graso (degeneración grasa) de hígado, no clasificado bajo otro concepto|Trastorno psicótico breve
Otros trastornos de personalidad y de conducta debidos a afección fisiológica conocida|Psicosis no especificada no debida a sustancia o afección fisiológica conocidas
Cefalea tensional crónica, no intratable|Psicosis no especificada no debida a sustancia o afección fisiológica conocidas
Leiomioma de útero, no especificado|Otros tipos de esquizofrenia
Envenenamiento por otros opiáceos, accidental (no intencionado), contacto inicial|Psicosis no especificada no debida a sustancia o afección fisiológica conocidas
Efecto adverso de glucocorticoides y análogos sintéticos, contacto inicial|Psicosis no especificada no debida a sustancia o afección fisiológica conocidas
Neoplasia maligna de lóbulo superior, bronquio o pulmón izquierdo|Psicosis no especificada no debida a sustancia o afección fisiológica conocidas
Neoplasia maligna secundaria de hueso|Psicosis no especificada no debida a sustancia o afección fisiológica conocidas
Contacto para cuidados paliativos|Psicosis no especificada no debida a sustancia o afección fisiológica conocidas
Historia personal de otra neoplasia maligna de intestino grueso|Psicosis no especificada no debida a sustancia o afección fisiológica conocidas
Historia personal de quimioterapia antineoplásica|Psicosis no especificada no debida a sustancia o afección fisiológica conocidas
Caquexia|Otros tipos de esquizofrenia
Envenenamiento por otros antipsicóticos y neurolépticos, accidental (no intencionado), contacto inicial|Trastornos esquizoafectivos
Trastorno del riñón y del uréter, no especificado|Trastornos esquizoafectivos
Lugar no especificado de residencia no institucional (privada) no especificada, como lugar del acontecimiento de la causa externa|Trastornos esquizoafectivos
Dermatitis seborreica, no especificada|Trastornos esquizoafectivos
Bursitis de hombro izquierdo|Trastornos esquizoafectivos
Efecto adverso de fármacos antiepilépticos e hipnótico-sedantes no especificados, contacto inicial|Trastornos esquizoafectivos
Neoplasia benigna de hipófisis|Trastorno psicótico breve
Amigdalitis aguda, no especificada|Otros tipos de esquizofrenia
Cálculo de conducto biliar sin colangitis ni colecistitis, con obstrucción|Esquizofrenia
Alimento en laringe que produce asfixia, contacto inicial|Esquizofrenia
Historia personal de malformaciones congénitas (corregidas) de la piel, extremidades y aparato musculoesquelético|Trastornos delirantes
Nódulo pulmonar solitario|Otros tipos de esquizofrenia
Demencia vascular, gravedad no especificada, sin alteración del comportamiento, alteración psicótica, alteración del estado de ánimo ni ansiedad|Otros tipos de esquizofrenia
Consumo de otra sustancia psicoactiva no especificado, con intoxicación y delirio|Otros tipos de esquizofrenia
Historia personal de embolia pulmonar|Otros tipos de esquizofrenia
Contusión de mano no especificada, contacto inicial|Otros tipos de esquizofrenia
Síndrome de Asperger|Otros tipos de esquizofrenia
Epilepsia (focal) (parcial) sintomática relacionada con la localización y síndromes epilépticos con crisis parciales complejas, no intratable, con estado de mal epiléptico|Otros tipos de esquizofrenia
Neumonía lobar, microorganismo no especificado|Esquizofrenia
Otras alteraciones de la marcha y de la movilidad|Esquizofrenia
Streptococcus pneumoniae como causa de enfermedades clasificadas bajo otro concepto|Esquizofrenia
Diabetes insípida nefrogénica|Esquizofrenia
Efecto adverso de otros antipsicóticos y neurolépticos, contacto inicial|Esquizofrenia
Hiperuricemia sin signos de artritis inflamatoria y enfermedad tofácea|Trastornos esquizoafectivos
Incumplimiento del paciente con otro tratamiento y régimen médico|Trastorno esquizoide de personalidad
Contacto para reconocimiento médico psiquiátrico general, solicitado por la autoridad|Trastorno esquizoide de personalidad
Leiomioma de útero, no especificado|Psicosis no especificada no debida a sustancia o afección fisiológica conocidas
Carcinoma de conducto biliar intrahepático|Otros tipos de esquizofrenia
Efecto adverso de antipsicóticos y neurolépticos no especificados, secuela|Esquizofrenia
Quiste pilonidal sin absceso|Esquizofrenia
Hiperlipidemia mixta|Esquizofrenia
Acidosis|Trastornos delirantes
Otros tipos de despolarización prematura|Trastornos delirantes
Otros trastornos especificados de vejiga|Trastornos delirantes
Divertículo de vejiga|Trastornos delirantes
Gammapatía monoclonal|Trastornos delirantes
Hemangioma de estructuras intraabdominales|Trastornos delirantes
Otros problemas especificados relacionados con el grupo de apoyo primario|Trastornos delirantes
Neoplasia maligna de lóbulo superior, bronquio o pulmón izquierdo|Esquizofrenia
Neoplasia maligna secundaria de cerebro|Esquizofrenia
Neoplasia maligna secundaria de glándula suprarrenal derecha|Esquizofrenia
Cálculo de vesícula biliar sin colecistitis sin obstrucción|Esquizofrenia
Quiste de riñón, adquirido|Esquizofrenia
Contacto para cuidados paliativos|Esquizofrenia
Hemiplejia no especificada que afecta a lado derecho dominante|Esquizofrenia
Traumatismo, no especificado|Esquizofrenia
Historia personal de otra neoplasia maligna de intestino delgado|Trastornos delirantes
Historia familiar de discapacidad intelectual|Otros tipos de esquizofrenia
Neoplasia lipomatosa benigna de piel y tejido subcutáneo de brazo izquierdo|Esquizofrenia
Quemadura de grado no especificado de cabeza, cara y cuello de localización no especificada, contacto inicial|Esquizofrenia
Lesiones autoinfligidas intencionadamente por otros medios especificados, contacto inicial|Esquizofrenia
Neoplasia benigna de vejiga|Esquizofrenia
Presencia de marcapasos cardíaco|Esquizofrenia
Trastorno de ansiedad, no especificado|Esquizofrenia
Cefalea tensional, no especificada, no intratable|Esquizofrenia
Bloqueo auriculoventricular no especificado|Otros tipos de esquizofrenia
Neumotórax posprocedimiento|Otros tipos de esquizofrenia
Cefalea tensional, no especificada, no intratable|Otros tipos de esquizofrenia
Trastorno de ansiedad, no especificado|Otros tipos de esquizofrenia
Neoplasia maligna de cerebro, no especificada|Otros tipos de esquizofrenia
Presencia de marcapasos cardíaco|Otros tipos de esquizofrenia
Hemorragia gastrointestinal, no especificada|Otros tipos de esquizofrenia
Enfermedad degenerativa del sistema nervioso, no especificada|Otros tipos de esquizofrenia
Estado de extracción de catarata, ojo no especificado|Esquizofrenia
Síncope y colapso|Psicosis no especificada no debida a sustancia o afección fisiológica conocidas
Otra enfermedad cerebrovascular|Psicosis no especificada no debida a sustancia o afección fisiológica conocidas
Neoplasia benigna de huesos de cráneo y cara|Psicosis no especificada no debida a sustancia o afección fisiológica conocidas
Historia personal de otras neoplasias malignas de piel|Psicosis no especificada no debida a sustancia o afección fisiológica conocidas
Estado de extracción de catarata, ojo izquierdo|Psicosis no especificada no debida a sustancia o afección fisiológica conocidas
Historia personal de pólipos colónicos|Psicosis no especificada no debida a sustancia o afección fisiológica conocidas
Hiperosmolaridad e hipernatremia|Psicosis no especificada no debida a sustancia o afección fisiológica conocidas
Hiperuricemia sin signos de artritis inflamatoria y enfermedad tofácea|Psicosis no especificada no debida a sustancia o afección fisiológica conocidas
Historia personal de dependencia a nicotina|Psicosis no especificada no debida a sustancia o afección fisiológica conocidas
Trastorno de personalidad obsesivo-compulsivo|Trastornos delirantes
Otros acontecimientos de la vida que generan estrés en la familia y el hogar|Trastornos delirantes
Síndrome de desgarro-hemorragia gastroesofágico|Otros tipos de esquizofrenia
Fractura de trocánter no especificado de fémur derecho, contacto inicial por fractura cerrada|Esquizofrenia
Enfermedad por reflujo gastroesofágico sin esofagitis|Esquizofrenia
Complicaciones vasculares después de infusión, transfusión e inyección terapéutica, contacto inicial|Otros tipos de esquizofrenia
Kwashiorkor|Otros tipos de esquizofrenia
Artrosis no especificada, localización no especificada|Otros tipos de esquizofrenia
Vitíligo|Otros tipos de esquizofrenia
Historia personal de otras neoplasias malignas de piel|Otros tipos de esquizofrenia
Capacidad intelectual límite|Trastornos delirantes
Neoplasia maligna de lóbulo superior, bronquio o pulmón derecho|Trastorno esquizotípico
Compresión de vena|Trastorno esquizotípico
Paralisis del sueño aislada recurrente|Trastorno esquizotípico
Otros trastornos respiratorios especificados|Trastorno esquizotípico
Infección por Staphylococcus aureus sensible a meticilina como causa de enfermedades clasificadas bajo otro concepto|Trastorno esquizotípico
Otros trastornos específicos de personalidad y comportamiento del adulto|Trastorno esquizotípico
Dependencia de nicotina, cigarrillos, sin complicaciones|Trastorno esquizotípico
Dependencia de alcohol, sin complicaciones|Trastorno esquizotípico
Problemas relacionados con vivir solo|Trastorno esquizotípico
Alcalosis|Otros tipos de esquizofrenia
Capacidad intelectual límite|Esquizofrenia
Infradosificación de otros antipsicóticos y neurolépticos, contacto inicial|Esquizofrenia
Pancreatitis aguda biliar|Esquizofrenia
Pancreatitis aguda, no especificada|Esquizofrenia
Dependencia de otra sustancia psicoactiva, sin complicaciones|Otros tipos de esquizofrenia
Estado de ligadura de trompas (de Falopio)|Trastorno psicótico breve
Trastorno límite de personalidad|Trastornos delirantes
Trastornos reumáticos tanto de la válvula mitral como de la aórtica|Esquizofrenia
Otros tipos de espondilosis, región lumbar|Esquizofrenia
Lordosis no especificada, región lumbar|Esquizofrenia
Fractura de parte no especificada del cuello de fémur derecho, contacto inicial por fractura cerrada|Psicosis no especificada no debida a sustancia o afección fisiológica conocidas
Estado de artrodesis|Psicosis no especificada no debida a sustancia o afección fisiológica conocidas
Trastorno psicótico con alucinaciones debido a afección fisiológica conocida|Trastornos delirantes
Estado de alergia a contrastes radiográficos|Trastornos delirantes
Demencia en otras enfermedades clasificadas bajo otro concepto, gravedad no especificada, sin alteración del comportamiento, alteración psicótica, alteración del estado de ánimo ni ansiedad|Trastornos delirantes
Uso prolongado (actual) de antitrombóticos / antiplaquetarios|Trastornos delirantes
Síncope y colapso|Trastornos delirantes
Klebsiella pneumoniae [K. pneumoniae] como causa de enfermedades clasificadas bajo otro concepto|Trastornos delirantes
Resistencia a antibióticos beta lactámicos no especificados|Trastornos delirantes
Resistencia a penicilinas|Trastornos delirantes
Resistencia a quinolonas y fluoroquinolonas|Trastornos delirantes
Resistencia a otro único tipo de antibiótico especificado|Trastornos delirantes
Fibrosis pulmonar idiopática|Esquizofrenia
Trastorno de personalidad histriónica|Esquizofrenia
Trastorno disociativo y de conversión, no especificado|Esquizofrenia
Enfermedad intersticial pulmonar, no especificada|Esquizofrenia
Trastorno adaptativo con estado de ánimo depresivo|Esquizofrenia
Malnutrición calórico-proteica grave no especificada|Esquizofrenia
Historia familiar de neoplasia maligna de órganos digestivos|Trastornos esquizoafectivos
Neoplasia maligna secundaria de glándula suprarrenal no especificada|Otros tipos de esquizofrenia
Trastorno obsesivo-compulsivo, no especificado|Trastornos delirantes
Contusión de otra parte de la cabeza, contacto inicial|Trastornos delirantes
Urticaria, no especificada|Trastornos delirantes
Epilepsia y otros síndromes epilépticos generalizados, no intratables, sin estado de mal epiléptico|Psicosis no especificada no debida a sustancia o afección fisiológica conocidas
Trastorno esquizoide de personalidad|Psicosis no especificada no debida a sustancia o afección fisiológica conocidas
Enfermedad hepática alcohólica, no especificada|Psicosis no especificada no debida a sustancia o afección fisiológica conocidas
Dependencia de alcohol, en remisión|Psicosis no especificada no debida a sustancia o afección fisiológica conocidas
Dependencia de alcohol, en remisión|Trastornos esquizoafectivos
Trastorno esquizoide de personalidad|Trastornos esquizoafectivos
Arteritis, no especificada|Otros tipos de esquizofrenia
Insuficiencia ventricular izquierda, no especificada|Trastornos delirantes
Presencia de angioplastia, injertos y prótesis coronarios|Trastornos delirantes
Consumo de tabaco|Trastornos delirantes
Estado angioplastia vascular periférico con implantes e injertos|Trastornos delirantes
Historia personal de otra neoplasia maligna de bronquios y pulmón|Otros tipos de esquizofrenia
Otros tipos de enfermedades pulmonares intersticiales especificadas|Esquizofrenia
Diverticulosis de colon sin perforación ni absceso, sin hemorragia|Esquizofrenia
Úlcera crónica no debida a presión en nalga, de gravedad no especificada|Otros tipos de esquizofrenia
Quemadura de grado no especificado de mano no especificada de localización no especificada, secuela|Otros tipos de esquizofrenia
Anemia poshemorrágica aguda|Trastornos delirantes
Hipoxemia|Trastornos delirantes
Aterosclerosis de aorta|Trastornos delirantes
Fractura no especificada de extremo superior de húmero derecho, contacto inicial por fractura cerrada|Trastornos delirantes
Otro cuerpo extraño en vías respiratorias, parte no especificada, que produce otras lesiones, contacto inicial|Trastornos delirantes
Enfermedad de Alzheimer de comienzo tardío|Trastornos delirantes
Diverticulitis de colon sin perforación ni absceso, con hemorragia|Trastornos delirantes
Quistes cerebrales|Trastorno psicótico breve
Problemas relacionados con el empleo no especificados|Trastorno psicótico breve
Familiar dependiente que requiere cuidados en el hogar|Otros tipos de esquizofrenia
Síndrome de respuesta inflamatoria sistémica (SIRS) de origen no infeccioso con disfunción orgánica aguda|Otros tipos de esquizofrenia
Diabetes mellitus tipo 2 con catarata diabética|Esquizofrenia
Otros tipos de encefalopatía|Esquizofrenia
Historia personal de neoplasia maligna de mama|Esquizofrenia
Historia personal de quimioterapia antineoplásica|Esquizofrenia
Ausencia adquirida de mama y pezón izquierdos|Esquizofrenia
Fibrilación auricular crónica|Esquizofrenia
Portador o sospecha de portador de Staphylococcus aureus resistente a meticilina|Esquizofrenia
Hiperpotasemia|Esquizofrenia
Consumo de otra sustancia psicoactiva, no especificado, con trastorno psicótico con ideas delirantes inducido por sustancias psicoactivas|Otros tipos de esquizofrenia
Trastorno de personalidad histriónica|Psicosis no especificada no debida a sustancia o afección fisiológica conocidas
Trastorno de personalidad narcisista|Psicosis no especificada no debida a sustancia o afección fisiológica conocidas
Trastorno de personalidad antisocial|Psicosis no especificada no debida a sustancia o afección fisiológica conocidas
Trastorno de personalidad evitativa|Psicosis no especificada no debida a sustancia o afección fisiológica conocidas
Trastorno de personalidad obsesivo-compulsivo|Psicosis no especificada no debida a sustancia o afección fisiológica conocidas
Trastorno de personalidad dependiente|Psicosis no especificada no debida a sustancia o afección fisiológica conocidas
Bloqueo auriculoventricular, completo|Psicosis no especificada no debida a sustancia o afección fisiológica conocidas
Paraplejia completa|Psicosis no especificada no debida a sustancia o afección fisiológica conocidas
Estreñimiento, no especificado|Esquizofrenia
Alteración transitoria de conciencia|Esquizofrenia
Fractura por estallido estable de vértebras D11-D12, secuela|Esquizofrenia
Lesiones autoinfligidas intencionadamente al saltar desde un lugar alto, secuela|Esquizofrenia
Leiomioma de útero, no especificado|Esquizofrenia
Parálisis del tercer nervio craneal [oculomotor], ojo no especificado |Otros tipos de esquizofrenia
Diplopía|Otros tipos de esquizofrenia
Quistes cerebrales|Otros tipos de esquizofrenia
Envenenamiento por otros fármacos psicótropos, accidental (no intencionado), contacto inicial|Otros tipos de esquizofrenia
